{
  "gate": "HG-02",
  "decision": "approved",
  "signer": "Product owner (sudarshanalk), acting as clinical reviewer",
  "role": "ACT-03 clinical reviewer",
  "date": "2026-10-27",
  "ratified_decisions": [
    "DEC-02",
    "DEC-03",
    "DEC-04",
    "DEC-05",
    "DEC-06",
    "DEC-07",
    "DEC-09",
    "DEC-12",
    "DEC-25",
    "DEC-29",
    "DEC-33",
    "DEC-45",
    "DEC-47",
    "DEC-48",
    "DEC-49",
    "DEC-50",
    "DEC-51",
    "DEC-52",
    "DEC-53",
    "DEC-54",
    "DEC-55",
    "DEC-56",
    "DEC-57",
    "DEC-58",
    "DEC-59",
    "DEC-60",
    "DEC-61",
    "DEC-62",
    "DEC-63",
    "DEC-64",
    "DEC-65",
    "DEC-66",
    "DEC-67",
    "DEC-68",
    "DEC-69",
    "DEC-70",
    "DEC-71",
    "DEC-72",
    "DEC-73",
    "DEC-74",
    "DEC-75",
    "DEC-76",
    "DEC-77",
    "DEC-78",
    "DEC-79",
    "DEC-80",
    "DEC-81",
    "DEC-82",
    "DEC-83",
    "DEC-84",
    "DEC-85",
    "DEC-86",
    "DEC-87"
  ],
  "deferred_items": [],
  "tag": null,
  "notes": "Owner instructions in chat, 27 Oct 2026: 'use these in the protein calculator', 'take this as the signed off the protein tool', 'the diabetes risk assessment tool I want to go as it is now', 'take part C, D, E and F as signed off', 'take stage 1 is signed off'. Parts A to F of the HG-02 review pack signed; Part D medical-device position confirmed (educational and screening information service, not a medical device); Part E as written; Part F C1 and C2 accepted (DEC-87). Overridden at HG-02: DEC-37, DEC-44 (by DEC-86 and DEC-87)."
}
