{
  "gate": "HG-01",
  "decision": "approved",
  "signer": "Product owner (sudarshanalk)",
  "role": "ACT-04 release owner / product owner",
  "date": "2026-10-23",
  "ratified_decisions": [
    "DEC-01",
    "DEC-08",
    "DEC-10",
    "DEC-13",
    "DEC-14",
    "DEC-15",
    "DEC-16",
    "DEC-19",
    "DEC-22",
    "DEC-23",
    "DEC-26",
    "DEC-31",
    "DEC-34",
    "DEC-35",
    "DEC-39",
    "DEC-40",
    "DEC-41",
    "DEC-42",
    "DEC-43",
    "DEC-46"
  ],
  "deferred_items": [
    "FR1-01 AS-03 visual baselines (needs Docker/Playwright run; deferred to HG-02)",
    "ORC-01 QDiabetes oracle run and FX-DM-BAND inputs (needs Docker, OI-4; deferred to HG-02)",
    "DEC-46 verification of production config.php (needs OI-1/OI-2; remains an HG-01 item to be closed before the first production deploy)"
  ],
  "tag": null,
  "notes": "Owner instruction in chat, 23 Oct 2026: 'go ahead with HG-01, ratify all defaults'. AS-IS report accepted as reports/as-is/audit-tools-endpoints.md and audit-wordpress.md."
}